{"boundaries":{"execution_authority":"NONE","execution_promise":false},"quality":{"checks":[{"name":"RAW_CALL_RECALCULATION","result":"PASS"},{"name":"CONTRACT_ICR_AGREEMENT","result":"PASS"},{"name":"QUEUE_EVIDENCE_POLICY","result":"PASS"}],"limitations":["Mezo Testnet snapshot; read only, not financial advice.","Debt and collateral already include pending rewards; principal and interest are not counted twice.","Interest accrual and future oracle changes alter these snapshot quantities.","The MCR crossing assumes constant debt and collateral; recovery-mode liquidation rules also apply.","Redemption rank skips positions below MCR; redeemable debt ahead excludes each eligible position liquidation reserve.","RPC observations and a block hash do not prove chain inclusion or oracle authenticity."],"reason_codes":[],"snapshot_status":"VALID_FOR_SNAPSHOT_CALCULATION"},"report_id":"e92f4833-33ff-4c09-bb6d-e13907f4d3b8","reproducibility":{"algorithm_sha256":"e4a835fed589bdc42f760c4b46ee4a0975099588eeaf93e3ba9d39743403fc37","dependency_lock_sha256":"104ad611b8faac11d9e31fd8d9afe079188b8ab6d4afdfe45f321dd57a085055","engine_commit":"ab15182dd14641ea613a47bab4d295e91046d67d"},"request":{"borrower":"0xDA04759E54728B6636Fe48F7c9795c7B609bAaAa","product_id":"trove_risk"},"schema":"liqvera-trove-risk-report/v1","source":{"created_at":"2026-10-23T18:01:57.883Z","source_at":"2026-10-23T18:01:43Z","source_mode":"live-public"},"trove_risk":{"block_hash":"0x3005372a8a059499aa907b1eb2939383209ad06f2c28b1865ba3f87fa765ddcc","block_number":"16323457","borrower":"0xDA04759E54728B6636Fe48F7c9795c7B609bAaAa","buffer_pct":"0.2679722164690690800974365226","caveats":["Mezo Testnet snapshot; read only, not financial advice.","Debt and collateral already include pending rewards; principal and interest are not counted twice.","Interest accrual and future oracle changes alter these snapshot quantities.","The MCR crossing assumes constant debt and collateral; recovery-mode liquidation rules also apply.","Redemption rank skips positions below MCR; redeemable debt ahead excludes each eligible position liquidation reserve.","RPC observations and a block hash do not prove chain inclusion or oracle authenticity."],"ccr":"1.5","collateral_btc":"0.029938","contract_status":1,"debt_ahead_musd":"0","debt_musd":"2212.217970297067894896","explorer_links":{"block":"https://explorer.test.mezo.org/block/16323457","price_feed":"https://explorer.test.mezo.org/address/0x86bCF0841622a5dAC14A313a15f96A95421b9366","sorted_troves":"https://explorer.test.mezo.org/address/0x722E4D24FD6Ff8b0AC679450F3D91294607268fA","trove_manager":"https://explorer.test.mezo.org/address/0xE47c80e8c23f6B4A1aE41c34837a0599D5D16bb0"},"flags":[],"icr":"1.102947694381159759","icr_atomic":"1102947694381159759","interest_musd":"10.227980297067894896","liquidation_price_musd":"81282.64303984149523634177300","liquidation_reserve_musd":"200","mcr":"1.1","price_musd":"81500.45794","price_source":"PriceFeed.fetchPrice()","principal_musd":"2201.98999","queue_status":"PROVEN","redeemable_debt_ahead_musd":"0","redemption_position":1,"scenarios":[{"icr":"0.992652924943043783","price_change_pct":"-10","price_musd":"73350.412146","status":"LIQUIDATABLE"},{"icr":"0.882358155504927807","price_change_pct":"-20","price_musd":"65200.366352","status":"LIQUIDATABLE"},{"icr":"0.772063386066811831","price_change_pct":"-30","price_musd":"57050.320558","status":"LIQUIDATABLE"}],"sorted_troves_size":300,"status":"ACTIVE","tcr":"2.927938289160928581"}}
